{
  "anchoring": {
    "quarantined": false,
    "status": "unanchored"
  },
  "bundle": {
    "digest": "a041e6306a6db3178805b70832cdc6ea1c96a83d07a281b0dea158da1bf48add",
    "schema_version": 1
  },
  "exit_code": 0,
  "reason_code": null,
  "reasons": [],
  "result": "pass",
  "schema_version": 1,
  "taxonomy_version": 1
}
